Id,ProductId,UserId,ProfileName,HelpfulnessNumerator,HelpfulnessDenominator,Score,Time,Summary,Text,Processed_Summary,Processed_Text,ROUGE-1 Precision,ROUGE-1 Recall,ROUGE-1 F1,ROUGE-2 Precision,ROUGE-2 Recall,ROUGE-2 F1,ROUGE-L Precision,ROUGE-L Recall,ROUGE-L F1
927,B000ER6YO0,A2F0WNTW3QQZYS,Ruth,0,0,5,1298505600,One of our favorites,"This is one of my son's favorite baby foods.  It does have a bit of sweetness, but not too sweet.  It's more runny than some of the other flavors, so we use a deeper spoon with this one, or add a little rice cereal to thicken it up.",one favorites,one son s favorite baby foods bit sweetness sweet s runny flavors use deeper spoon one add little rice cereal thicken,0.024390243902439025,1.0,0.047619047619047616,0.0,0.0,0.0,0.024390243902439025,1.0,0.047619047619047616
631,B000G6RYNE,A1IVFBJA9KAI1M,Shane Martin,2,3,4,1191369600,Tasty!,"The chips come in a large box with individually wrapped bags of chips. The bags are very strong - much thicker than, say, Lay's potato chip bags. Inside are very tasty kettle cooked chips, salted just right. Because these appear to be cooked in an actual kettle fashion, some are cooked more than others, which gives it a more authentic, non-manufactured feel. Some people may not like that.<br /><br />I reccomend them!",tasty,chips come large box individually wrapped bags chips bags strong much thicker say lay s potato chip bags inside tasty kettle cooked chips salted right appear cooked actual kettle fashion cooked others gives authentic nonmanufactured feel people may like thati reccomend,0.022727272727272728,1.0,0.044444444444444446,0.0,0.0,0.0,0.022727272727272728,1.0,0.044444444444444446
683,B000G6MBX2,A1UDFKEKTO70NX,Tiffany,1,1,4,1245110400,tasty,"These chips are perfect for snacking with or without salsa. The texture is brittle and thin, like other Plocky's chips.<br /><br />The only downside: the spice is minimal.",tasty,chips perfect snacking without salsa texture brittle thin like plocky s chipsthe downside spice minimal,0.0,0.0,0.0,0.0,0.0,0.0,0.0,0.0,0.0
515,B000G6RYNE,A16S0NQ3MWJXFL,ObsidianGT,0,1,5,1291248000,"Delicious, what else did you expect?","Seriously, now. Tasty, tasty, tasty. Fresh, too!<br /><br />The only problem is that you have a pack of 24 and that can lend itself to wanting to make multiple trips to the cupboard for more helpings! Or, grabbing multiple bags to begin with. Pace yourself! I keep saying.<br /><br />You can't go wrong with these if you're a fan of the salt and vinegar classic flavor.<br /><br />2-ounce bags are about double the size of the kid's bags; about the same size as the ones in the small gas station racks. It's really a good size for an adult.<br /><br />It's a somewhat healthier snack than a typical bag of fried chips, but it has 300 calories per bag. Again, not too bad, but something to think about.<br /><br />Bottom-line: Delicious!",delicious else expect,seriously tasty tasty tasty fresh problem pack 24 lend wanting make multiple trips cupboard helpings grabbing multiple bags begin pace keep sayingyou ca nt go wrong re fan salt vinegar classic flavor2ounce bags double size kid s bags size ones small gas station racks s really good size adultit s somewhat healthier snack typical bag fried chips 300 calories per bag bad something think aboutbottomline delicious,0.015151515151515152,0.3333333333333333,0.028985507246376812,0.0,0.0,0.0,0.015151515151515152,0.3333333333333333,0.028985507246376812
366,B00437JI8Q,A4TLHOUT1PHTL,Alison,0,0,5,1346198400,Can't find anywhere else!,"My fiance loves these dark chocolate and nut granola bars and all the grocery stores around us don't carry them anymore!  Once again, Amazon came through and he couldn't be happier.",ca nt find anywhere else,fiance loves dark chocolate nut granola bars grocery stores around us nt carry anymore amazon came could nt happier,0.045454545454545456,0.2,0.07407407407407407,0.0,0.0,0.0,0.045454545454545456,0.2,0.07407407407407407
656,B002BCD2OG,A18TQ3KJY1J015,"P. Ernst ""4beanerboy""",8,8,5,1265241600,Great buy!,First time I've ever used Agave Nectar -- and it is great.  Keeps the blood sugar stable.  Great buy also!,great buy,first time ve ever used agave nectar great keeps blood sugar stable great buy also,0.1111111111111111,1.0,0.19999999999999998,0.058823529411764705,1.0,0.1111111111111111,0.1111111111111111,1.0,0.19999999999999998
657,B002BCD2OG,A1Q1AUJ3E43I8G,purple lotus,1,1,5,1288656000,excellent sweetner,"This sweetner is the best, it brings out the true flavors in what ever you add it to. And it has great health benefts.",excellent sweetner,sweetner best brings true flavors ever add great health benefts,0.07692307692307693,0.5,0.13333333333333336,0.0,0.0,0.0,0.07692307692307693,0.5,0.13333333333333336
530,B000G6RYNE,AY1EF0GOH80EK,Natasha Stryker,3,3,5,1327708800,Do not miss the salt!,"Someone brought these to a party we had last month and I didn't put them out because the buffet was full and didn't think anyone would like saltless potato chips.  Last week we had some friends over and these were all I had in the pantry so I put them out.  OH MY GOSH THEY ARE SO GOOD!  I was so wrong to think they would be bland; they are full of real potato flavor, wonderfully crisp and very fresh tasting.  I am here on amazon to buy a case, I only want to have these with dips.  Truly delicious!",miss salt,someone brought party last month nt put buffet full nt think anyone would like saltless potato chips last week friends pantry put oh gosh good wrong think would bland full real potato flavor wonderfully crisp fresh tasting amazon buy case want dips truly delicious,0.0,0.0,0.0,0.0,0.0,0.0,0.0,0.0,0.0
322,B000JEHAHS,AJ7Q49CTJ1BOC,24fan,4,4,5,1168473600,Great gag gift,Put this in my husbands stocking for Christmas and it was a hit.,great gag gift,put husbands stocking christmas hit,0.0,0.0,0.0,0.0,0.0,0.0,0.0,0.0,0.0
71,B001GVISJC,A27TKQHFW0FB5N,Chet,2,2,5,1254355200,Great Gummi!,"These Albanese gummi bears and rings and so on are very good and tasty and high quality. The bears even have little faces. At my local candy store this type of gummi stuff (bears, rings, snakes, balls, worms, whatever) are about $10/lb. These twin packs of 4.5 or 5 pound bags is a screaming deal as far as I'm concerned. I'm probably 50 pounds deep in these friggin' things. Consumed!",great gummi,albanese gummi bears rings good tasty high quality bears even little faces local candy store type gummi stuff bears rings snakes balls worms whatever 10lb twin packs 45 5 pound bags screaming deal far m concerned m probably 50 pounds deep friggin things consumed,0.01282051282051282,0.5,0.025,0.0,0.0,0.0,0.01282051282051282,0.5,0.025
891,B000HDMUQ2,A1XKHPDL7JJBK5,"Pamela Garland ""celiac""",0,0,5,1206835200,Great bars for gluten-free diets!,"If you want a really good snack bar try these, they are healthy and taste as good as any granola bar, but without the gluten!! I buy these regularly.",great bars glutenfree diets,want really good snack bar try healthy taste good granola bar without gluten buy regularly,0.058823529411764705,0.25,0.09523809523809523,0.0,0.0,0.0,0.058823529411764705,0.25,0.09523809523809523
372,B002O3VHXU,A2129VQGGHR150,Carol C.,0,0,5,1313366400,My favorite,Green Mountain is my favorite brand. Nantucket is my favorite coffee from Green Mountain. Very smooth flavor. Not too strong and not too weak.,favorite,green mountain favorite brand nantucket favorite coffee green mountain smooth flavor strong weak,0.05,1.0,0.09523809523809523,0.0,0.0,0.0,0.05,1.0,0.09523809523809523
768,B009HINRX8,A2CAZG1CQ8BQI5,Patricia J. Nohalty,0,0,5,1337212800,Kona for Tassimo,Of all the coffee's available for Tassimo this Kona has the richest flavor and fantastic aroma by<br />far my favorite.,kona tassimo,coffee s available tassimo kona richest flavor fantastic aroma byfar favorite,0.18181818181818182,1.0,0.3076923076923077,0.0,0.0,0.0,0.09090909090909091,0.5,0.15384615384615385
457,B000G6RYNE,A13VD7TJDWVOEC,Deborah E. Bumpus,0,0,5,1258329600,Best Kettle Chips!,"As a professional potato chip muncher, I see these as thee very BEST on the market. Rich taste and flavor!! Almost impossible not to finish the entire bag.The true meaning of decadence!",best kettle chips,professional potato chip muncher see thee best market rich taste flavor almost impossible finish entire bagthe true meaning decadence,0.10526315789473684,0.6666666666666666,0.18181818181818182,0.0,0.0,0.0,0.05263157894736842,0.3333333333333333,0.09090909090909091
248,B007TFONH0,A10IFYN5U6X20R,onemagoo,0,0,5,1350172800,Best way to buy kcups,"Once you've tried some random sampler packs (and now are overloaded with decafs,extra bolds, or teas), this is a great way to get exactly the brands or style that you want.  Received the order in a couple of days and was exactly what I ordered.  This was my second order and I'll be ordering this item again.",best way buy kcups,ve tried random sampler packs overloaded decafs extra bolds teas great way get exactly brands style want received order couple days exactly ordered second order ll ordering item,0.03333333333333333,0.25,0.058823529411764705,0.0,0.0,0.0,0.03333333333333333,0.25,0.058823529411764705
612,B000G6RYNE,A1JBB01LAK69LV,Rubyred,1,1,4,1212105600,The chip with a kiss of salt,"These chips are delectably delicious. I am on a low sodium diet. I didn't have to give up totally something that I truely love to snack. These chips are bursting with flavor, and you can't really tell they are missing all that salt. There is just a kiss worth on a chip, but beleive me, it is a total makeout!!!",chip kiss salt,chips delectably delicious low sodium diet nt give totally something truely love snack chips bursting flavor ca nt really tell missing salt kiss worth chip beleive total makeout,0.1,1.0,0.18181818181818182,0.0,0.0,0.0,0.06666666666666667,0.6666666666666666,0.1212121212121212
706,B000G6MBX2,ACNON4BZACUUL,"mommyofchristopher ""mommyofchristopher""",0,0,5,1217030400,Delicious and additive,"Love these chips, and I don't even like black beans.  Very tasty.  Yum!!  Plus, good for you!",delicious additive,love chips nt even like black beans tasty yum plus good,0.0,0.0,0.0,0.0,0.0,0.0,0.0,0.0,0.0
980,B001EQ4DVQ,A38FWXBFJX210N,Terri,0,0,5,1252713600,Great taste,"These are great for at work, just pop the instant bag in for a minute then make your coffee. This is the best tasting coffee. It's easy to make without a mess.",great taste,great work pop instant bag minute make coffee best tasting coffee s easy make without mess,0.1,1.0,0.18181818181818182,0.0,0.0,0.0,0.1,1.0,0.18181818181818182
299,B001UJEN6C,AHAX3RWULQD6T,Kevin D. Schoeninger,1,1,5,1334793600,natural energy boost,"If you're looking for an energy boost without artificial sweeteners and other chemicals, this is a great option.  The taste is decent and it is a nice smooth uplift without jitters.",natural energy boost,re looking energy boost without artificial sweeteners chemicals great option taste decent nice smooth uplift without jitters,0.09523809523809523,0.6666666666666666,0.16666666666666666,0.05,0.5,0.09090909090909091,0.09523809523809523,0.6666666666666666,0.16666666666666666
102,B004K2IHUO,A3D1TXE98KRKYO,"Danny ""The Student""",2,3,4,1256515200,Great Support,"Arrived slightly thawed. My parents wouldn't accept it. However, the company was very helpful and issued a full refund.",great support,arrived slightly thawed parents would nt accept however company helpful issued full refund,0.0,0.0,0.0,0.0,0.0,0.0,0.0,0.0,0.0
961,B000S806VM,A2DN52HYY0X7XM,kimmi,0,0,5,1338336000,Great product.,Great tasting tea I have been looking for a good  Sassafras tea forever.Finally. I will be ordering this product again .<br />Thanks Kim:D,great product,great tasting tea looking good sassafras tea foreverfinally ordering product thanks kim,0.14285714285714285,1.0,0.25,0.0,0.0,0.0,0.14285714285714285,1.0,0.25
606,B000G6RYNE,A20ORC60J05BP3,M. Novak,1,1,5,1217289600,the defacto standard for Salt and Vinegar chips,"I've always liked Salt and Vinegar chips but most of the time the stronger flavor was at the bottom of the bag. Not with these, the vinegar is overflowing right from the first chip and doesnt stop until you've finished the bag. These are very addictive. If you like salt and vinegar, these are the ultimate chips. Nothing else compares.",defacto standard salt vinegar chips,ve always liked salt vinegar chips time stronger flavor bottom bag vinegar overflowing right first chip doesnt stop ve finished bag addictive like salt vinegar ultimate chips nothing else compares,0.09090909090909091,0.6,0.15789473684210525,0.0625,0.5,0.1111111111111111,0.09090909090909091,0.6,0.15789473684210525
214,B0009XLVGA,A1NHQNQ3TVXTZF,"Desert Girl ""chrissylovesherhusband""",3,10,1,1220227200,CHANGED FORMULA MAKES CATS SICK!!!!,"As with canidae, Felidae has also changed their formula.  Cats do not like change when it comes to their food.  And they just had to change it without putting it on their label.  We noticed the color of the food had changed and so did the smell.  (As you will notice I have also reviewd the Canidae, and this all happened the same time the dogs were having issues.)<br /><br />Prior to the change in food we had almost lost two of our cats because we had moved to a new home.  If cats get ""upset"" because of a change in enviorment, or a loud noise they can stop eating.  It depends on the cat.  Two of them had stopped eating and had lost a lot of weight.  We took them to the vet and it took months to get them back to normal.  It has been a year since then and they are better.  Then the formula for this food changed.<br /><br />We started to noitce they were not eating as much and it started to bug us.  We asked the shop owner of the feed store and she had no knowledge of any change to the food.  It wasn't until the we were in there with other customers yelling about their dogs food making their dogs sick.  Right away we changed the cats food and they started chowing down and haven't suffered one bit like our dogs have.<br /><br />Cats are sensitve animals and changes to thier food could cause them to stop eating.  Anyone thinking of purchasing this food should not do it!  We have 5 rescued and fixed cats, none of which are picky eaters and the change in this formula could have been the death of them had we not found out about the change in their formula.<br /><br />I urge anyone that has had these problems to go to the consumer affairs website and also the FDA website and write a letter to them to let them know how this has affected your animal.  As with canidae they do not care how the change has affected my animals, and tell me not to buy it.  This is just horrible!",changed formula makes cats sick,canidae felidae also changed formula cats like change comes food change without putting label noticed color food changed smell notice also reviewd canidae happened time dogs issues prior change food almost lost two cats moved new home cats get upset change enviorment loud noise stop eating depends cat two stopped eating lost lot weight took vet took months get back normal year since better formula food changedwe started noitce eating much started bug us asked shop owner feed store knowledge change food nt customers yelling dogs food making dogs sick right away changed cats food started chowing nt suffered one bit like dogs havecats sensitve animals changes thier food could cause stop eating anyone thinking purchasing food 5 rescued fixed cats none picky eaters change formula could death found change formulai urge anyone problems go consumer affairs website also fda website write letter let know affected animal canidae care change affected animals tell buy horrible,0.03205128205128205,1.0,0.062111801242236024,0.0064516129032258064,0.25,0.012578616352201257,0.02564102564102564,0.8,0.049689440993788817
238,B000WFRMRW,A3Q7QBDSAZ670I,B. Barnett,0,0,4,1331251200,High Quality... But it gave my dog wicked gas..,"The recommendation when we bought our puppies (lhasa/bichon mix and lhasa/poodle mix) was that we continue them on the food that they have had since being weaned. This is a somewhat expensive food so I can't say that we were terribly pleased but we loaded up on the stuff and headed home.<br /><br />Let me just say this, I have had small dogs before. Never have I seen such gas issues. Both of them consistently had foul gas. Consistently. Usually when they're sitting on our laps but, you know. They're dogs.<br /><br />When we got through the first bag of this stuff, we purchased more on amazon. It was a great price for it since we got a 40 lb bag for the price of (I think) a 15 lb bag at Petco. But, they continued to have gas. I mean, they loved the food, don't get me wrong and they loved it more when we'd mix in some water and it would be like soft food. Somehow that made their gas worse but I think I'll have to give that responsible to the speed with which they chowed down- can't blame the food itself for gluttony.<br /><br />Eventually, we switched their food. No more farting. I think it was due to the high fat content which undoubtedly is necessary for very small puppies. They just need that in their diet. I think that we were advised to keep them on it for much longer than was useful (they said up until 1 year). Yeah right, you try dealing with gas for that long. Around 6 mos of age we switched to PuppyChow. Much better. Granted, they don't like it as much, but we humans like it a whole lot better.",high quality gave dog wicked gas,recommendation bought puppies lhasabichon mix lhasapoodle mix continue food since weaned somewhat expensive food ca nt say terribly pleased loaded stuff headed homelet say small dogs never seen gas issues consistently foul gas consistently usually re sitting laps know re dogswhen got first bag stuff purchased amazon great price since got 40 lb bag price think 15 lb bag petco continued gas mean loved food nt get wrong loved d mix water would like soft food somehow made gas worse think ll give responsible speed chowed down ca nt blame food gluttonyeventually switched food farting think due high fat content undoubtedly necessary small puppies need diet think advised keep much longer useful said 1 year yeah right try dealing gas long around 6 mos age switched puppychow much better granted nt like much humans like whole lot better,0.02127659574468085,0.5,0.04081632653061224,0.0,0.0,0.0,0.014184397163120567,0.3333333333333333,0.027210884353741496
594,B000G6RYNE,A3L5L1NZIKLSJU,"E. Demir ""emiko""",1,1,2,1289433600,"Kettle Chips, Sea Salt","There is nothing too good or too bad about these chips. If you like plain potato chips, you'd like these. They are thicker than most brands, fresh out of box, very crunchy and not too salty (for me). One bag has a lot, I generally cannot finish it by myself. Part of the reason is that they are too oily (some chips almost look transparent, if you know what I mean). The taste of oil is a bit too overwhelming for me. If you are used to more spicy chips you may not like these since they do not have any spice, except salt, as the name says. I don't think I'll buy these again. The ""best by"" date on my bags are March 2011 and I ordered them at the end of October.",kettle chips sea salt,nothing good bad chips like plain potato chips d like thicker brands fresh box crunchy salty one bag lot generally finish part reason oily chips almost look transparent know mean taste oil bit overwhelming used spicy chips may like since spice except salt name says nt think ll buy best date bags march 2011 ordered end october,0.029411764705882353,0.5,0.05555555555555555,0.0,0.0,0.0,0.029411764705882353,0.5,0.05555555555555555
282,B001D07IPG,AQX8FF2YCO3J7,"Little D, Nigel, and Oliver's mom",0,0,5,1247529600,Excellent Taste,This is one of the best tasting crisps I have ever eaten! I only buy it on special occassions because I know I'll eat the whole bag.,excellent taste,one best tasting crisps ever eaten buy special occassions know ll eat whole bag,0.03125,0.5,0.058823529411764705,0.0,0.0,0.0,0.03125,0.5,0.058823529411764705
378,B003YXWAF8,AS89BWXQRDAMV,crpar,2,3,5,1335139200,Deliciously scrumptious,"Sir Kensington's did a great job of updating the classic ketchup with this wonderful product. The refreshed taste of this Ketchup is a great update, and now leaves me disappointed when I'm given Heinz while out at a restaurant.<br /><br />For you Heinz die hard fans out there, this is not the ketchup for you. But for those of you who wish you always knew what ketchup could be without the chemical aftertaste found in Heinz, be sure to give this Ketchup a try.<br /><br />Don't forget the spiced variety. Purchasing the pack with both the classic and spiced variety for your first Sir Kensington experience is definitely the way to go.",deliciously scrumptious,sir kensington s great job updating classic ketchup wonderful product refreshed taste ketchup great update leaves disappointed m given heinz restaurantfor heinz die hard fans ketchup wish always knew ketchup could without chemical aftertaste found heinz sure give ketchup trydo nt forget spiced variety purchasing pack classic spiced variety first sir kensington experience definitely way go,0.0,0.0,0.0,0.0,0.0,0.0,0.0,0.0,0.0
287,B000H13270,AVQIRN6E7J7UA,imdebra,0,4,3,1280534400,Not mild enough for me lol,"Nothing wrong with the product, but I sure had to mix it with *lots* of other ingredients to make it edible to me. (In Texas I was called a ""baby-mouth"" - not into very spicy-hot foods.)<br /><br />For comparison, I'm comfortable with Tostitos medium chunky salsa. 1 can of this milder Rotel, mixed with 2 slightly larger cans of diced tomatoes, was still way too hot for me to use as salsa for chips. I used some of this to make a sort of southwestern cornbread that was good though.",mild enough lol,nothing wrong product sure mix lots ingredients make edible texas called babymouth spicyhot foods comparison m comfortable tostitos medium chunky salsa 1 milder rotel mixed 2 slightly larger cans diced tomatoes still way hot use salsa chips used make sort southwestern cornbread good though,0.0,0.0,0.0,0.0,0.0,0.0,0.0,0.0,0.0
389,B001ESOQAM,A2609IIYREBZRT,Duchess in Denim,0,0,5,1295481600,Fresh and Tasty,These nuts arrived fresh and are very tasty.  They are not broken or dirty looking like cashews sometimes can.,fresh tasty,nuts arrived fresh tasty broken dirty looking like cashews sometimes,0.004008016032064128,1.0,0.007984031936127744,0.002008032128514056,1.0,0.004008016032064128,0.004008016032064128,1.0,0.007984031936127744
884,B000HDMUQ2,A2D293ADQ5HCLF,Blish,0,0,4,1274832000,small but good,"Tasty, convenient bars for people with celiac disease. They seem to have gotten smaller over time, but the taste and convenience outweigh the reduction in size (and the price).",small good,tasty convenient bars people celiac disease seem gotten smaller time taste convenience outweigh reduction size price,0.0,0.0,0.0,0.0,0.0,0.0,0.0,0.0,0.0
718,B000G6MBX2,A3NCTCNAUYCH6H,jesse girl,0,1,3,1278374400,Kind of Bland,"These were not flavorful enough for my taste. It seems that all the seasoning falls off the chips and sinks to the bottom of the bag. Too bad, because I really liked the idea of a healthier potato chip. I would not buy these again.",kind bland,flavorful enough taste seems seasoning falls chips sinks bottom bag bad really liked idea healthier potato chip would buy,0.0,0.0,0.0,0.0,0.0,0.0,0.0,0.0,0.0
794,B000UZMJZO,AZ3FPU1QSFBC6,annifree,0,1,5,1299974400,I love this tea - to each her own taste buds!,"I love the aroma and the taste of the fruit and vanilla combo, and the addition of ginseng for an added energy boost rounds this tea out nicely for me. It's a sweet tea, which makes it a wonderful healthy alternative to desert after dinner.<br /><br />I see that others didn't like it, but it's really a matter of personal taste...different courses for different horses!",love tea taste buds,love aroma taste fruit vanilla combo addition ginseng added energy boost rounds tea nicely s sweet tea makes wonderful healthy alternative desert dinneri see others nt like s really matter personal taste different courses different horses,0.07142857142857142,0.75,0.13043478260869565,0.0,0.0,0.0,0.07142857142857142,0.75,0.13043478260869565
97,B0019CW0HE,A18AAABCIJKC5Q,Rhiever,0,0,5,1303776000,Great dog food,"My 1-1/2 year old basenji/jack russell mix loves this dog food. He's been noticeably healthier and more energetic since I switched him over from the standard dog foods earlier this year. Despite the higher cost of natural dog foods, I find that he eats significantly less of the Natural Balance dog foods and still stays happy and full. On the normal dog foods, he'd eat up to 3 cups of dog food a day (the recommended serving for his size), whereas he only eats about 1 cup to 1-1/2 cup of the Natural Balance dog food a day. When you take this into account, you're actually getting more ""bang for your buck"" with the natural dog foods since you don't have to buy as much to last just as long as the normal dog foods... and a healthier, happier dog, to boot! Add in the fact that you can get free, 2-day shipping with Amazon Prime... I'm sold!!",great dog food,112 year old basenjijack russell mix loves dog food s noticeably healthier energetic since switched standard dog foods earlier year despite higher cost natural dog foods find eats significantly less natural balance dog foods still stays happy full normal dog foods d eat 3 cups dog food day recommended serving size whereas eats 1 cup 112 cup natural balance dog food day take account re actually getting bang buck natural dog foods since nt buy much last long normal dog foods healthier happier dog boot add fact get free 2day shipping amazon prime m sold,0.019417475728155338,0.6666666666666666,0.03773584905660377,0.00980392156862745,0.5,0.019230769230769232,0.019417475728155338,0.6666666666666666,0.03773584905660377
