Id,ProductId,UserId,ProfileName,HelpfulnessNumerator,HelpfulnessDenominator,Score,Time,Summary,Text,Processed_Summary,Processed_Text,ROUGE-1 Precision,ROUGE-1 Recall,ROUGE-1 F1,ROUGE-2 Precision,ROUGE-2 Recall,ROUGE-2 F1,ROUGE-L Precision,ROUGE-L Recall,ROUGE-L F1
441,B000G6RYNE,A3EEBE82C3HYRD,David,0,0,3,1304726400,"Honey Dijon leaves bad aftertaste, NY Cheddar are pretty good","Honey Dijon flavor: okay flavor, but both my girlfriend and I thought they left a bad aftertaste. The aftertaste is sort of like old cheese (presumably some folks like this... I'm not a fancy cheese eater), and it lingers for at least an hour. I'd give this flavor a rating of 2 stars out of 5.<br /><br />We have also tried the NY Cheddar flavor (4 stars), which we both liked better, and they didn't leave any long-lingering or bad aftertaste.<br /><br />I'd give the consistency of the chips 4 stars. The chips are crunchy, but also greasy enough that I keep a napkin near or wash my hands after eating Kettle Chips.",honey dijon leaves bad aftertaste ny cheddar pretty good,honey dijon flavor okay flavor girlfriend thought left bad aftertaste aftertaste sort like old cheese presumably folks like m fancy cheese eater lingers least hour d give flavor rating 2 stars 5we also tried ny cheddar flavor 4 stars liked better nt leave longlingering bad aftertastei d give consistency chips 4 stars chips crunchy also greasy enough keep napkin near wash hands eating kettle chips,0.05511811023622047,0.7777777777777778,0.10294117647058823,0.023809523809523808,0.375,0.04477611940298507,0.047244094488188976,0.6666666666666666,0.08823529411764706
1001,B004A8VV42,AO2ZY713W85C7,mendiy,2,2,5,1296172800,best babka,I never in my life tasted such a good babka its crazy good! This is the real babka! That my gram mother use to make,best babka,never life tasted good babka crazy good real babka gram mother use make,0.05555555555555555,0.5,0.09999999999999999,0.0,0.0,0.0,0.05555555555555555,0.5,0.09999999999999999
532,B000G6RYNE,A15U6JW86FB9OV,P. Bangera,3,3,5,1214611200,Best Chips out there!!!,"I have tried Herrs, UTZ, wise, pringles, lays etc....but Kettle tasted the best. The quantity of salt used is the optimum which is required.<br /><br />Although they say serving size 1 ounce, you will finish the whole packet in no time. Total calories is 300 for 2 ounce bag. This is slightly on the higher side. But still it is ok, as they have not compromised on the taste.<br /><br />Only issue was that all packets have some burnt chips, which taste bad. Kettle should take care when packing to ensure no burnt chips are there.<br /><br />Thanks to Amazon to get 24 bags for just 12 bucks with free shipping using their coupon.",best chips,tried herrs utz wise pringles lays etc kettle tasted best quantity salt used optimum requiredalthough say serving size 1 ounce finish whole packet time total calories 300 2 ounce bag slightly higher side still ok compromised tasteonly issue packets burnt chips taste bad kettle take care packing ensure burnt chips therethanks amazon get 24 bags 12 bucks free shipping using coupon,0.03125,1.0,0.06060606060606061,0.0,0.0,0.0,0.03125,1.0,0.06060606060606061
56,B002GWHC0G,A2EFAW1P3DRXWO,TJ Fairfax,0,0,5,1349395200,Our guests love it!,"We roast these in a large cast iron pan on the grill (about 1/3 of the bag at a time).  The smell is wonderful and the roasted beans taste delicious too.  More importantly, the coffee is smooth; no bitter aftertaste.  On numerous occasions, we've had to send the roasted beans home with friends because they like it so much.",guests love,roast large cast iron pan grill 13 bag time smell wonderful roasted beans taste delicious importantly coffee smooth bitter aftertaste numerous occasions ve send roasted beans home friends like much,0.0,0.0,0.0,0.0,0.0,0.0,0.0,0.0,0.0
121,B003SE19UK,A3A52DETIFZNZS,Sarah Wilson,4,4,5,1309564800,Great food.,"I have done a lot of research to find the best food for my cat, and this is an excellent food.  That is also according to my holistic veterinarian.  They put probiotics on the kibble as the last step, which is very important to me.  The best thing is that my cat loved it immediately and I had to stop mixing it with the old food because she only would eat Holistic Select.",great food,done lot research find best food cat excellent food also according holistic veterinarian put probiotics kibble last step important best thing cat loved immediately stop mixing old food would eat holistic select,0.002008032128514056,0.5,0.003999999999999999,0.0,0.0,0.0,0.002008032128514056,0.5,0.003999999999999999
529,B000G6RYNE,A1BXG0K7UD9CTD,"MicTrik ""mictrik""",20,27,1,1254009600,They changed the Chips now they taste horrible,"I once loved these chips and they were the only chips i would buy.  I discovered them when I was in England back in 2000 and quickly became a fan.  About a year ago I picked up a bag that was on sale at my local supermarket.  I was finding it odd that they were on sale so much but took advantage of it.  After opening the bag I found the chips were not even close to the Kettle chips I was used to.  They were all uniform whitish yellow in color, flavor was way off, the lovely extra crisp brown chips were gone completely and I was very disappointed.  So I e-mailed Kettle with the following:  ""What Happened? I bought this bag of chips the other day and they have a very different taste; It tastes ""cheaper"". I don't know how else to put it... I also noticed that the chips seemed to be less cooked as I did not see any of the browner colored chips that have the most flavor. I am hoping that nothing has changed with the ingredients or process used to produce this product. Did I just get a weird batch? I have been buying only Kettle Chips for about 10 years now so I am wondering.""  I did receive a reply: ""Thanks for letting us know about your experience with your Kettle Brand Chips. It sounds like you may have received a bag that should not have slipped by our inspections, and we apologize.Our potatoes do vary seasonally which could account for a variation in color-but our chips should still taste great!Thanks for providing us with the ""best before"" code from the bag.  This really helps when passing on your comments to our staff.<br />We are sending some coupons to replace your purchase with any of our Kettle Brand flavors or nut butters, believing you will have a great experience with your next purchase! In case you buy this product again, we suggest avoiding the same best before date (if you still have it) in the rare instance another bag from the same case slipped by our inspections at the same time.<br />Thanks again for letting us know about this and expect the coupons to arrive within 3 weeks.  Please let me know if I can be of any more help.""  Well the next bag was good.  Since that time I have picked up 3 bags of chips all were like the ""bad"" bag so I am pretty sure that they have changed there product to reduce cost.  I did some research and found out that Kettle was bought out by a private equity company.  So the same cookie cutter management processes are probably being employed at Kettle.  Acquire company with high quality brand recognition, sell product to mass merchants, lower quality/cost of product to increase margin and finally sell company just before the customer base starts to realize that the brand is no longer a quality brand.  increased profits make the company more valuable on paper so they make a nice profit for the investors. Customer and employees lose out of course as does an unsuspecting buyer of the exploited brand.  Stay away from Kettle chips they are no longer the same...",changed chips taste horrible,loved chips chips would buy discovered england back 2000 quickly became fan year ago picked bag sale local supermarket finding odd sale much took advantage opening bag found chips even close kettle chips used uniform whitish yellow color flavor way lovely extra crisp brown chips gone completely disappointed emailed kettle following happened bought bag chips day different taste tastes cheaper nt know else put also noticed chips seemed less cooked see browner colored chips flavor hoping nothing changed ingredients process used produce product get weird batch buying kettle chips 10 years wondering receive reply thanks letting us know experience kettle brand chips sounds like may received bag slipped inspections apologizeour potatoes vary seasonally could account variation colorbut chips still taste great thanks providing us best code bag really helps passing comments staffwe sending coupons replace purchase kettle brand flavors nut butters believing great experience next purchase case buy product suggest avoiding best date still rare instance another bag case slipped inspections timethanks letting us know expect coupons arrive within 3 weeks please let know help well next bag good since time picked 3 bags chips like bad bag pretty sure changed product reduce cost research found kettle bought private equity company cookie cutter management processes probably employed kettle acquire company high quality brand recognition sell product mass merchants lower qualitycost product increase margin finally sell company customer base starts realize brand longer quality brand increased profits make company valuable paper make nice profit investors customer employees lose course unsuspecting buyer exploited brand stay away kettle chips longer,0.011278195488721804,0.75,0.022222222222222223,0.0,0.0,0.0,0.011278195488721804,0.75,0.022222222222222223
26,B001GVISJM,A3FONPR03H3PJS,"Deborah S. Linzer ""Cat Lady""",0,0,5,1288310400,Twizzlers - Strawberry,"Product received is as advertised.<br /><br /><a href=""http://www.amazon.com/gp/product/B001GVISJM"">Twizzlers, Strawberry, 16-Ounce Bags (Pack of 6)</a>",twizzlers strawberry,product received advertisedtwizzlers strawberry 16ounce bags pack 6,0.07142857142857142,0.5,0.125,0.0,0.0,0.0,0.07142857142857142,0.5,0.125
73,B006SQBRMA,ATYMT48R62ENE,Marie,0,0,5,1327017600,Best ever latice tart,"I ordered two of these and two of raspberry latice tarts directly from FantasiCakes website for a dinner party I was hosting. It arrived fresh and intact. Very good size. I froze half for later use. I am a pastry lover and these were the best I've ever tasted. The pastry was soft, the jam was really good and the taste was great. They were gone in no time. My guests were really impressed.",best ever latice tart,ordered two two raspberry latice tarts directly fantasicakes website dinner party hosting arrived fresh intact good size froze half later use pastry lover best ve ever tasted pastry soft jam really good taste great gone time guests really impressed,0.1,1.0,0.18181818181818182,0.02564102564102564,0.3333333333333333,0.047619047619047616,0.05,0.5,0.09090909090909091
45,B001EO5QW8,A2G7B7FKP2O2PU,D. Leschke,0,0,5,1209686400,Great taste and convenience,We really like the McCann's steel cut oats but find we don't cook it up too often.<br />This tastes much better to me than the grocery store brands and is just as convenient.<br />Anything that keeps me eating oatmeal regularly is a good thing.,great taste convenience,really like mccann s steel cut oats find nt cook oftenthis tastes much better grocery store brands convenientanything keeps eating oatmeal regularly good thing,0.04,0.3333333333333333,0.07142857142857142,0.0,0.0,0.0,0.04,0.3333333333333333,0.07142857142857142
250,B000GGKQSO,A1OE23J37ZPDXE,Donald Edward Liberman,0,0,5,1270944000,keeps you out of the dentest chair,If used on a daily basis you will keep your gums healty and between your teeth clean and free of plack.,keeps dentest chair,used daily basis keep gums healty teeth clean free plack,0.05555555555555555,0.3333333333333333,0.09523809523809525,0.0,0.0,0.0,0.05555555555555555,0.3333333333333333,0.09523809523809525
395,B001ELL6O8,A13T2G4T8LR8XA,First Time Mom,2,2,5,1189296000,Delisious Pancakes,Before I discover this mix on Amazon I always bought it in Whole Food Store.<br />I like this mix and when I am doing the pancakes they came very delicious and fluffy.<br />Just one small secret: Try to add the Seltzer water instead of regular one.,delisious pancakes,discover mix amazon always bought whole food storei like mix pancakes came delicious fluffyjust one small secret try add seltzer water instead regular one,0.027777777777777776,0.5,0.05263157894736842,0.0,0.0,0.0,0.027777777777777776,0.5,0.05263157894736842
913,B000ER6YO0,A26L4JZZ9C1GT5,Alison Denton Jones,1,1,4,1287964800,good for you but not best flavor,"We love earth's best organic baby food, but this is not the tastiest one. I've tried it myself and think it is pretty gross. But my daughter still eats it, just not with as much enthusiasm as other flavors. It's got a decent amount of protein, which is important for us as a vegetarian family.",good best flavor,love earth s best organic baby food tastiest one ve tried think pretty gross daughter still eats much enthusiasm flavors s got decent amount protein important us vegetarian family,0.058823529411764705,0.6666666666666666,0.10810810810810811,0.0,0.0,0.0,0.058823529411764705,0.6666666666666666,0.10810810810810811
899,B002DXZI40,AYZZSRYAIXNOS,"I Heart Amazon ""I heart Shopping""",0,0,5,1296432000,I can't take the smell,"The product is all that it says it is which is why I gave it 5 stars.  However, I do have issues with the product, namely, me and my family members can't take the smell.  The taste is horrible so I put it in a lotion cream and rubbed it on my skin.  This was a few weeks ago and though I've since changed my sheets, the scent is still in my bed.  Ultimately, I stopped using it because it made me smell in a way I did not like.  It smells like an Indian spice and while it didn't work for me, scent-wise, it may work fine with someone else.",ca nt take smell,product says gave 5 stars however issues product namely family members ca nt take smell taste horrible put lotion cream rubbed skin weeks ago though ve since changed sheets scent still bed ultimately stopped using made smell way like smells like indian spice nt work scentwise may work fine someone else,0.06896551724137931,1.0,0.12903225806451613,0.05263157894736842,1.0,0.1,0.06896551724137931,1.0,0.12903225806451613
746,B001LO4ZWI,A1K7OUOZGT6EG3,"Zak Rudy ""muzak""",5,6,5,1328659200,Anti-Oxidant Smoothie,"Bear with me while I do amazon's work for them and copy from the Lakewood website:<br />---------------------------------------<br />Nutrition Facts<br />32oz UPC 042608460503<br /><br />Serving Size 8 oz<br />Serving Size 240 ml<br />Amount Per Serving<br />Calories 125  Calories from Fat 25<br />% Daily Value*<br />Total Fat 3.5g  6%<br />Saturated Fat 0.5g  4%<br />Trans Fat 0g<br />Cholesterol 0mg  0%<br />Potassium 370mg  10%<br />Sodium 25mg  1%<br />Total Carbohydrate 28g  9%<br />Dietary Fiber 4g  16%<br />Sugars 21g<br />Protein 2g<br /><br />Omega 3 40mg, Omega 6 600mg, Omega 9 2400mg, Vitamin A 20%, Vitamin C 100%, Calcium 6%, Iron 8%, Vitamin E 6%, Vitamin B1 (Thiamin) 6%, Vitamin B2 (Riboflavin) 4%, Niacin 6%, Vitamin B6 8%, Folate 8%, Magnesium 8%, Zinc 2%, Phosphorous 4%, Vitamin K 15%,<br />*Percent Daily values are based on a 2,000 calorie diet<br /><br />Ingredients<br />Certified Organic Juice Blend (Organic Acai, Organic Apple, Organic Concord Grape, Organic Grape, Organic Pomegranate, Organic Blackberry, Organic Blueberry, Organic Red Tart Cherry, And Organic Acerola Cherry From Concentrate); Organic Goji Berry, Natural Fiber (Organic Guar, Xanthan, Carrageenan, Sodium Alginate And Organic Locust Bean), And Organic Rose Hip.<br /><br />Gluten FREE* Casein FREE GMO FREE*<br />100% Fruit Juices are Gluten-Free<br />---------------------------------------<br /><br />This is an excellent Lakewood juice- they call it juice but it's as thick as an Odwalla drink like a smoothie. With all that's in it, this is a very good value. Considering you can pay as much for any one of the ingredients in it. My personal use is to add this to kombucha, maximizing it's longevity that way, I've tried many but this one is the best for kombucha. They say an 8oz glass has 2 servings of fruit on the Lakewood website. It's quite tasty in that it's not too sweet, very thick textured even with the tiny bits of seed in it reminiscent of a banana smoothie. The ingredient list is somewhat confusing but note that only the Acerola Cherry is from concentrate, everything else is fresh pressed. Acai is very high on the ORAC scale of anti-oxidants, Rose Hips are also very high, everything else is in the mid to high range of fruit. Pomegranate has many beneficial properties beyond just anti-oxidants as well, it's a noteworthy fighter of heart disease and Alzheimer's type dementia. Considering the price of Goji berries I really like their inclusion in this drink, albeit at a lesser level.<br /><br />BTW: Amazon had only 1 day wait before shipping.",antioxidant smoothie,bear amazon s work copy lakewood website nutrition facts32oz upc 042608460503serving size 8 ozserving size 240 mlamount per servingcalories 125 calories fat 25 daily value total fat 35g 6 saturated fat 05g 4 trans fat 0gcholesterol 0mg 0 potassium 370mg 10 sodium 25mg 1 total carbohydrate 28g 9 dietary fiber 4g 16 sugars 21gprotein 2gomega 3 40mg omega 6 600mg omega 9 2400mg vitamin 20 vitamin c 100 calcium 6 iron 8 vitamin e 6 vitamin b1 thiamin 6 vitamin b2 riboflavin 4 niacin 6 vitamin b6 8 folate 8 magnesium 8 zinc 2 phosphorous 4 vitamin k 15 percent daily values based 2000 calorie dietingredientscertified organic juice blend organic acai organic apple organic concord grape organic grape organic pomegranate organic blackberry organic blueberry organic red tart cherry organic acerola cherry concentrate organic goji berry natural fiber organic guar xanthan carrageenan sodium alginate organic locust bean organic rose hipgluten free casein free gmo free 100 fruit juices glutenfree this excellent lakewood juice call juice s thick odwalla drink like smoothie s good value considering pay much one ingredients personal use add kombucha maximizing s longevity way ve tried many one best kombucha say 8oz glass 2 servings fruit lakewood website s quite tasty s sweet thick textured even tiny bits seed reminiscent banana smoothie ingredient list somewhat confusing note acerola cherry concentrate everything else fresh pressed acai high orac scale antioxidants rose hips also high everything else mid high range fruit pomegranate many beneficial properties beyond antioxidants well s noteworthy fighter heart disease alzheimer s type dementia considering price goji berries really like inclusion drink albeit lesser levelbtw amazon 1 day wait shipping,0.006734006734006734,1.0,0.013377926421404682,0.0,0.0,0.0,0.003367003367003367,0.5,0.006688963210702341
199,B0028C44Z0,A3U94LRA4I8YAL,"Brenda Woodward ""love to read""",2,3,5,1265932800,Tasty!!,These mints are really strong and have a great taste. They are also a convenient size to carry in a pocket or purse.,tasty,mints really strong great taste also convenient size carry pocket purse,0.0,0.0,0.0,0.0,0.0,0.0,0.0,0.0,0.0
815,B004ET7MG8,A33VG37SOTA0YS,Daxvieor,0,0,3,1345507200,"Good sugarless gum, with stronger gum for better bubble blowing than other sugarless gums","Besides that mentioned in the title, the only other remarks I have about it is the price is hard to beat, the taste is akin to a Flintstone strawberry vitamin (for those of you that have tasted them), and taste lasts for not very long.  I'd say, on a scale of 1 to 10 with 10 lasting an extraordinary amount of time this would be a 3.  Also, the taste really diminishes to a subdued sweet after a very short amount of time.",good sugarless gum stronger gum better bubble blowing sugarless gums,besides mentioned title remarks price hard beat taste akin flintstone strawberry vitamin tasted taste lasts long d say scale 1 10 10 lasting extraordinary amount time would 3 also taste really diminishes subdued sweet short amount time,0.0,0.0,0.0,0.0,0.0,0.0,0.0,0.0,0.0
356,B002J2DO8W,ASIAOU4JW8LUG,K. Gohokar,0,0,5,1331596800,great taste,This is what I was looking for and was missing it. The taste is exactly the taste as the one made in India so just loved it and remember my days back in India. Definitely recommend it.,great taste,looking missing taste exactly taste one made india loved remember days back india definitely recommend,0.058823529411764705,0.5,0.10526315789473684,0.0,0.0,0.0,0.058823529411764705,0.5,0.10526315789473684
324,B000JEHAHS,A1GUR2DMGWUIGL,"Annie ""Annie""",1,4,3,1200182400,Penguin Pooper,Toy was typical quality I expected.  I got taken for a major ride on the shipping!,penguin pooper,toy typical quality expected got taken major ride shipping,0.0,0.0,0.0,0.0,0.0,0.0,0.0,0.0,0.0
875,B000HDMUQ2,AJY5Y3SHROG5C,A. Grillet,3,3,2,1215561600,The chocolate ones are much better,"I have recently stopped eating a number of allergens (dairy, soy, nuts) and these were one of the few snacks which fit into my dietary restrictions.  Unfortunately, these were pretty gross - miserable texture and more cardboard flavored than berry.  I threw them away.  I would recommend the cocoa ones as they are much tastier and also allergen free.",chocolate ones much better,recently stopped eating number allergens dairy soy nuts one snacks fit dietary restrictions unfortunately pretty gross miserable texture cardboard flavored berry threw away would recommend cocoa ones much tastier also allergen free,0.0625,0.5,0.1111111111111111,0.03225806451612903,0.3333333333333333,0.0588235294117647,0.0625,0.5,0.1111111111111111
826,B003AO5DLO,A1SCDZZWN02VVN,Mickey &amp; Moose,0,0,5,1350864000,GOOD FOOD!,"We are Chocolate Moose & Mickey Moose,<br /><br />Our nice owner bought this great food for us.  We love it very much, I have gained 5 lbs. because I eat all of Mickey's food when he isn't looking!  Our skin and fur is much better now too.  :)",good food,chocolate moose mickey moose nice owner bought great food us love much gained 5 lbs eat mickey s food nt looking skin fur much better,0.0029585798816568047,0.5,0.0058823529411764705,0.0,0.0,0.0,0.0029585798816568047,0.5,0.0058823529411764705
236,B001HTL6CY,A1KLA02LZXAT46,Dandelion,0,0,2,1302307200,"Taste is neutral, quantity is DECEITFUL!","The taste of these white cheddar flat breads is like a regular cracker - which is not bad, except that I bought them because I wanted a cheese taste.<br /><br />What was a HUGE disappointment? How misleading the packaging of the box is. The photo on the box (I bought these in store) makes it look like it is full of long flatbreads (expanding the length and width of the box). Wrong! The plastic tray that holds the crackers is about 2"" smaller all around - leaving you with about 15 or so small flatbreads.<br /><br />What is also bad about this is that the company states they use biodegradable and eco-friendly packaging. FAIL! They used a HUGE box for a ridiculously small amount of crackers. Not ecofriendly at all.<br /><br />Would I buy these again? No - I feel ripped off. The other crackers (like Sesame Tarragon) give you a little<br />more bang for your buck and have more flavor.",taste neutral quantity deceitful,taste white cheddar flat breads like regular cracker bad except bought wanted cheese tastewhat huge disappointment misleading packaging box photo box bought store makes look like full long flatbreads expanding length width box wrong plastic tray holds crackers 2 smaller around leaving 15 small flatbreadswhat also bad company states use biodegradable ecofriendly packaging fail used huge box ridiculously small amount crackers ecofriendly allwould buy feel ripped crackers like sesame tarragon give littlemore bang buck flavor,0.012987012987012988,0.25,0.02469135802469136,0.0,0.0,0.0,0.012987012987012988,0.25,0.02469135802469136
579,B000G6RYNE,AV51MFS5XJXFP,candy lady,1,1,5,1349740800,a good buy,This is a real good product.I love these chips and so does my customers can't go wrong wit these the best,good buy,real good producti love chips customers ca nt go wrong wit best,0.07142857142857142,0.5,0.125,0.0,0.0,0.0,0.07142857142857142,0.5,0.125
946,B000ER6YO0,ATIHDHZYNQ0EI,"Kristen O'donnell ""twinsmom""",0,1,5,1270425600,Organic and Tasty,I'd continue to buy but I'm moving over to more home made finger foods and away from glass jars...shattered too many. They like all the flavors though. Great textures too.,organic tasty,d continue buy m moving home made finger foods away glass jars shattered many like flavors though great textures,0.0,0.0,0.0,0.0,0.0,0.0,0.0,0.0,0.0
940,B000ER6YO0,AP8QHMD5LS6KF,"Rochelle J. Flinn ""Rochelle Flinn""",0,0,5,1246838400,Geat Product,My son loves the Best Earth's baby food and his favorite seems to be the Vegetable and Turkey. He smiles at every mouthful.<br /><br />I would recommend this product to anyone who is looking for healthy feeding the organic way. All the food I feed my son is through Earth's Best.,geat product,son loves best earth s baby food favorite seems vegetable turkey smiles every mouthfuli would recommend product anyone looking healthy feeding organic way food feed son earth s best,0.034482758620689655,0.5,0.06451612903225806,0.0,0.0,0.0,0.034482758620689655,0.5,0.06451612903225806
