Id,ProductId,UserId,ProfileName,HelpfulnessNumerator,HelpfulnessDenominator,Score,Time,Summary,Text,Processed_Summary,Processed_Text,ROUGE-1 Precision,ROUGE-1 Recall,ROUGE-1 F1,ROUGE-2 Precision,ROUGE-2 Recall,ROUGE-2 F1,ROUGE-L Precision,ROUGE-L Recall,ROUGE-L F1
502,B000G6RYNE,A3TX8RH943OLBM,annie,3,5,2,1214006400,salt and vinegar chips,It was a great value and I like the package size but not vinegary enough for me. Won't order this brand again. Great chips otherwise.,salt vinegar chips,great value like package size vinegary enough wo nt order brand great chips otherwise,0.06666666666666667,0.3333333333333333,0.1111111111111111,0.0,0.0,0.0,0.06666666666666667,0.3333333333333333,0.1111111111111111
433,B000G6RYNE,A17V3UVYMI69TE,Patrick Tran,0,0,4,1327363200,PUCKER UP,"I love Kettle Brand Chips!<br />I've been in love with the Honey Dijon for years and decided to try out their other flavors.<br /><br />Sea Salt & Vinegar Chips are TANGY, SOUR, and make my lips pucker when I eat too many at a time.  I got 12 big bags for a steal from amazon ($11 WHAT?!?).<br /><br />Personally, the flavor is too much for me, but my mom & aunt LOVE them and they hate potato chips.",pucker,love kettle brand chips ve love honey dijon years decided try flavorssea salt vinegar chips tangy sour make lips pucker eat many time got 12 big bags steal amazon 11 personally flavor much mom aunt love hate potato chips,0.01694915254237288,1.0,0.03333333333333333,0.0,0.0,0.0,0.01694915254237288,1.0,0.03333333333333333
732,B002U56JXK,ASC04R0BT3TO4,"the BURNiNATOR ""raggle fraggle""",2,2,5,1303862400,Amazing,"Well being the big red fan that I am, I bought some of this. First of all let me tell you the price is amazing, I mean where else can you get this type of deal in Saudi Arabia. Everyone in village loved it, of course now they are wondering when the next shipment will get it.",amazing,well big red fan bought first let tell price amazing mean else get type deal saudi arabia everyone village loved course wondering next shipment get,0.03571428571428571,1.0,0.0689655172413793,0.0,0.0,0.0,0.03571428571428571,1.0,0.0689655172413793
138,B002SRYRE8,A21E0OJ4DSKXNA,Smileface,0,0,5,1342051200,Happy Face,Delicious. I cannot get Australian ginger where I live. This compares favorably to Australian Ginger I've purchased in other cities. Now I can enjoy it without traveling.,happy face,delicious get australian ginger live compares favorably australian ginger ve purchased cities enjoy without traveling,0.0,0.0,0.0,0.0,0.0,0.0,0.0,0.0,0.0
358,B001SB099M,A2XADCFYDXH7IV,Thomas A. Johnson,1,1,4,1320969600,Excellent Everyday Olive Oil,"Great stuff and dependable, especially when there are a million brands ""out there"" to choose from.  I love the stuff.  For really high end desires, I go with the Apollo Olive Oils from California.  But I buy a whole lot more of this stuff and will buy it again and again.",excellent everyday olive oil,great stuff dependable especially million brands choose love stuff really high end desires go apollo olive oils california buy whole lot stuff buy,0.08333333333333333,0.5,0.14285714285714285,0.043478260869565216,0.3333333333333333,0.07692307692307691,0.08333333333333333,0.5,0.14285714285714285
929,B000ER6YO0,A2NQKBC54RAZL5,Keribeth,0,0,5,1297296000,Our Baby's Favorite Dinner,The Rice and Lentil dinner is our son's absolute favorite. I don't know why but he gobbles this up every time. He enjoys most of the Earth's Best foods and we have only found a couple he doesn't eat (anything with too much apple) which is more a personal taste issue than the brand or particular combination. Some of the varieties tend to be too runny but this one has a great consistency right out of the jar.,baby s favorite dinner,rice lentil dinner son s absolute favorite nt know gobbles every time enjoys earth s best foods found couple nt eat anything much apple personal taste issue brand particular combination varieties tend runny one great consistency right jar,0.07142857142857142,0.75,0.13043478260869565,0.0,0.0,0.0,0.047619047619047616,0.5,0.08695652173913042
222,B001EO5ZMO,A1C5SHU81SRARN,Sophia T,0,0,5,1310688000,Best Ahmad Tea,"I've tried a variety of Ahmad tea. Not because I particularly like this brand, but they are just easier to come across.  The Imperial blend, I believe, is the most complex yet well balanced of all the ones I've tried. It's full body like a good cup of Assam, which by no means overpower the delightful, clean taste of Darjeerling, complete with a long lasting note of bergamot. I enjoy it best in the evening. It gives a satisfying and relaxing finish to a busy day.<br /><br />For those interested in the specifics: I use about 3 teaspoons of lose tea in a stainless steel infuser in a 16 oz mug, let it steep in 208F water for 2-3 min, take the infuser out, and drink it without sugar or milk to savor its sophistication.",best ahmad tea,ve tried variety ahmad tea particularly like brand easier come across imperial blend believe complex yet well balanced ones ve tried s full body like good cup assam means overpower delightful clean taste darjeerling complete long lasting note bergamot enjoy best evening gives satisfying relaxing finish busy dayfor interested specifics use 3 teaspoons lose tea stainless steel infuser 16 oz mug let steep 208f water 23 min take infuser drink without sugar milk savor sophistication,0.038461538461538464,1.0,0.07407407407407407,0.012987012987012988,0.5,0.025316455696202535,0.02564102564102564,0.6666666666666666,0.04938271604938271
754,B0035YE9CS,A7H19XVU8BGKB,Robert Ritter,1,1,5,1314489600,Gets My Vote,"My bottle arrived just in time for a sushi dinner and game night planned with friends.  I had three soy sauces to choose from.  After some sampling we were all using the Bluegrass!  Everyone enjoyed the light smoothness a subtle sweetness.  We were splashing right on every piece, rather that dunking/dipping. Friends wanted to know where I found it. I'm going back to order more right now, and I'll be ordering 3 extra bottles because they are going to make a great little gift that's affordable and unique; instead of the traditional bottle of wine that so common it's boring.",gets vote,bottle arrived time sushi dinner game night planned friends three soy sauces choose sampling using bluegrass everyone enjoyed light smoothness subtle sweetness splashing right every piece rather dunkingdipping friends wanted know found m going back order right ll ordering 3 extra bottles going make great little gift s affordable unique instead traditional bottle wine common s boring,0.0,0.0,0.0,0.0,0.0,0.0,0.0,0.0,0.0
595,B000G6RYNE,A5U1K1NRQEZW9,"L. Wang ""L. Wang""",1,1,3,1288310400,Good deal but close expiration date!,"I love this sea salt & vinegar flavor from Kettle.  When I saw this one on the daily deal here for $17.99/case, I put my order without doubt.  However, when I received the case, I found out that the whole case is expiring in December while I got it at the end of August.  I tried one package and I can definitely taste the unfreshness in the chips.  I was disappointed and then I found out this item is not returnable!  How convenient!  Although I love this chips, I won't order from here again with the concern of close expiration date...",good deal close expiration date,love sea salt vinegar flavor kettle saw one daily deal 1799case put order without doubt however received case found whole case expiring december got end august tried one package definitely taste unfreshness chips disappointed found item returnable convenient although love chips wo nt order concern close expiration date,0.0784313725490196,0.8,0.14285714285714285,0.04,0.5,0.07407407407407407,0.0784313725490196,0.8,0.14285714285714285
558,B000G6RYNE,A31MZR41SM9JU5,Mye,1,7,1,1288828800,Too SOUR!,"I love sour food but this one I can't bear.  Too strong sour taste... and even when you open the bag, the sour smell is too strong.  I don't like it.",sour,love sour food one ca nt bear strong sour taste even open bag sour smell strong nt like,0.025,1.0,0.04878048780487806,0.0,0.0,0.0,0.025,1.0,0.04878048780487806
364,B00437JI8Q,A2SLZMD0UYRT5X,cat's food,1,1,5,1323993600,GREAT SNACK,"I like eating these whenever I need an energy boost.<br />It has everything that I am searching for in a, ""To Go Snack"".<br />Fiber plus Chocolate is never a bad thing!!!",great snack,like eating whenever need energy boostit everything searching go snack fiber plus chocolate never bad thing,0.045454545454545456,0.5,0.08333333333333334,0.0,0.0,0.0,0.045454545454545456,0.5,0.08333333333333334
524,B000G6RYNE,A27C44BIRQH3QW,Stan Miastkowski,13,15,5,1185580800,The Best Chips...PERIOD!,"You don't need salt to hide the taste of potato chips. And these chips prove it. The taste of the potato comes through, instead of being masked. OK, so they're still a snack food, but no salt and no trans-fats mean these are about the healthiest potato chips you can get. And if you're on a low-salt diet (like I am), having these available means I can eat chips, and Kettle are just the best.",best chips period,nt need salt hide taste potato chips chips prove taste potato comes instead masked ok re still snack food salt transfats mean healthiest potato chips get re lowsalt diet like available means eat chips kettle best,0.05128205128205128,0.6666666666666666,0.09523809523809523,0.0,0.0,0.0,0.05128205128205128,0.6666666666666666,0.09523809523809523
209,B0028C44Z0,A3BJ9NS09YGQT5,"Atl Chris ""Atl Chris""",0,3,1,1314489600,These just don't do it for me as breath mints,"To me, these are nothing like the regular Altoids and are not breath mints. They are pleasant-tasting little candies in a cute convenient tin, and that's as far as it goes. The mintiness is just not strong, and the wintergreens are definitely weaker than the peppermint minis. I'm not a dragon-breath person, but still, one of these mints is too small to have any effect on my breath. Four or five will freshen my breath for a short while - maybe 15 minutes. At this point, I think the Icebreakers Frost mints are the best as sugar free breath mints.",nt breath mints,nothing like regular altoids breath mints pleasanttasting little candies cute convenient tin s far goes mintiness strong wintergreens definitely weaker peppermint minis m dragonbreath person still one mints small effect breath four five freshen breath short maybe 15 minutes point think icebreakers frost mints best sugar free breath mints,0.038461538461538464,0.6666666666666666,0.07272727272727274,0.0196078431372549,0.5,0.03773584905660377,0.038461538461538464,0.6666666666666666,0.07272727272727274
779,B007ZENY5W,AQZ9FQYW60HJ4,Home schooler,1,1,5,1339718400,Fantastic!,"My son made this.  He didn't have the patience to be precise about the water temperature and when, half an hour before it was done, it appeared not to have risen at all--I feared for the worse.  Determined to be polite, I agreed to have a sandwich using the bread.  It was amazing.  Apparently it rises during the baking or something.<br /><br />Great tangy flavor (perfect for a meat sandwich imho) and not heavy at all.  Fortunately we had lots of deli meats, since the whole loaf disappeared within the hour.<br /><br />We've had all but the sourdough peasant bread so far; I'm sure that will be delicious as well.",fantastic,son made nt patience precise water temperature half hour done appeared risen feared worse determined polite agreed sandwich using bread amazing apparently rises baking somethinggreat tangy flavor perfect meat sandwich imho heavy fortunately lots deli meats since whole loaf disappeared within hourwe ve sourdough peasant bread far m sure delicious well,0.0,0.0,0.0,0.0,0.0,0.0,0.0,0.0,0.0
335,B00469VSJI,A2EVOV2OZBQU53,Explorer777,0,0,1,1336694400,Does not taste very good,"Taste like it is stale.  Will not order this again.  I had this coffee at a 50th year annerversery at a reception hall and had to have it.  This stuff tasted NOTHING, like the Douwe Egberts at the hall.  This is possibly stale coffee.",taste good,taste like stale order coffee 50th year annerversery reception hall stuff tasted nothing like douwe egberts hall possibly stale coffee,0.022727272727272728,0.5,0.04347826086956522,0.0,0.0,0.0,0.022727272727272728,0.5,0.04347826086956522
211,B0009XLVGA,A2U3Z5S70AE80V,Margaret,2,2,5,1267920000,My cat loves it!,"I started my cat on Felidae Platinum about 3 weeks ago and she loves it. She's an older cat, somewhat overweight, and had a grouchy temperament. I first mixed it with her previous food and she figured out which was which -- she ate the Felidae and left the old food! She's now been on just the Felidae for about ten days now, off the old food entirely, and she is a much sweeter, happier cat. I think it must agree with her better or be more easily digested, or something. In any case, I am a happy purchaser of Felidae. I don't agree with the previous reviewer that cats don't like it. Clearly, mine does.",cat loves,started cat felidae platinum 3 weeks ago loves s older cat somewhat overweight grouchy temperament first mixed previous food figured ate felidae left old food s felidae ten days old food entirely much sweeter happier cat think must agree better easily digested something case happy purchaser felidae nt agree previous reviewer cats nt like clearly mine,0.021739130434782608,1.0,0.042553191489361694,0.0,0.0,0.0,0.021739130434782608,1.0,0.042553191489361694
351,B00067AD4U,A7DSY3M6P6RG3,taza052007,0,0,5,1181692800,These are the Best!,"These chocolate covered espresso beans are wonderful!  The chocolate is very dark and rich and the ""bean"" inside is a very delightful blend of flavors with just enough caffine to really give it a zing.",best,chocolate covered espresso beans wonderful chocolate dark rich bean inside delightful blend flavors enough caffine really give zing,0.0,0.0,0.0,0.0,0.0,0.0,0.0,0.0,0.0
79,B004X2KR36,A2AB7M9UCNBVN7,sharonh4,0,0,3,1346976000,Order only in cold weather,"The taste was great, but the berries had melted.  May order again in winter. If you order in cold weather you should enjoy flavor.",order cold weather,taste great berries melted may order winter order cold weather enjoy flavor,0.21428571428571427,1.0,0.35294117647058826,0.15384615384615385,1.0,0.2666666666666667,0.21428571428571427,1.0,0.35294117647058826
30,B0001PB9FY,A3HDKO7OW0QNK4,Canadian Fan,1,1,5,1107820800,The Best Hot Sauce in the World,"I don't know if it's the cactus or the tequila or just the unique combination of ingredients, but the flavour of this hot sauce makes it one of a kind!  We picked up a bottle once on a trip we were on and brought it back home with us and were totally blown away!  When we realized that we simply couldn't find it anywhere in our city we were bummed.<br /><br />Now, because of the magic of the internet, we have a case of the sauce and are ecstatic because of it.<br /><br />If you love hot sauce..I mean really love hot sauce, but don't want a sauce that tastelessly burns your throat, grab a bottle of Tequila Picante Gourmet de Inclan.  Just realize that once you taste it, you will never want to use any other sauce.<br /><br />Thank you for the personal, incredible service!",best hot sauce world,nt know s cactus tequila unique combination ingredients flavour hot sauce makes one kind picked bottle trip brought back home us totally blown away realized simply could nt find anywhere city bummednow magic internet case sauce ecstatic itif love hot sauce mean really love hot sauce nt want sauce tastelessly burns throat grab bottle tequila picante gourmet de inclan realize taste never want use saucethank personal incredible service,0.028169014084507043,0.5,0.05333333333333334,0.014285714285714285,0.3333333333333333,0.0273972602739726,0.028169014084507043,0.5,0.05333333333333334
281,B001D07IPG,A3BUE5AHX4M0FS,"P. Clermont ""learning God's word""",0,0,5,1272326400,YUMMY,"I found these crisps at our local WalMart & figured I would give them a try. They were so yummy I may never go back to regular chips, not that I was a big chip fan anyway. The only problem is I can eat the entire bag in one sitting. I give these crisps a big thumbs up!",yummy,found crisps local walmart figured would give try yummy may never go back regular chips big chip fan anyway problem eat entire bag one sitting give crisps big thumbs,0.03333333333333333,1.0,0.06451612903225806,0.0,0.0,0.0,0.03333333333333333,1.0,0.06451612903225806
508,B000G6RYNE,A39Y59C6FTC0GL,Christine,1,2,2,1247788800,"Love Kettle Chips, but not this flavor!",I was really looking forward to trying these chips since I love cheese but I was SUPER DISAPPOINTED! I am a big fan of Kettle Chips but these tasted somewhat stale and almost plain! They are supposed to have a cheddar taste but you cannot taste any of that...it's annoying. I do not recommend this flavor..salt and vinegar and buffalo bleu are my favorite.,love kettle chips flavor,really looking forward trying chips since love cheese super disappointed big fan kettle chips tasted somewhat stale almost plain supposed cheddar taste taste s annoying recommend flavor salt vinegar buffalo bleu favorite,0.11764705882352941,1.0,0.21052631578947367,0.030303030303030304,0.3333333333333333,0.05555555555555555,0.11764705882352941,1.0,0.21052631578947367
653,B002U56JXU,A6GMEO3VRY51S,microjoe,0,0,5,1294272000,Made in Michigan since 1866,"I like ""Vernor's"", and drink it all the time. It is old fashioned drink from Michigan, since 1866, and the labeling was known for its lovely green and gold colors and the gnome character. If you look at the can it is actually called ginger soda instead of ale and is different than typical ginger ale in taste. Vernors has a strong vanilla presence, is smoother and more moist, and sweeter than a ginger ale. It is closer to a cream soda than ginger ale, very good. A ginger ale is more dry, higher in carbonation, and has a spicier bite to it. Vernors has 39 grams sugar per can, versus 33 grams per can for Schweppes Ginger Ale. Neither has caffeine.<br /><br />The recipe has changed a bit over the years mostly in the choice of sweeteners. They use the same high fructose corn syrup that the cost-cutting mega soda companies use, rather than the cane sugar they used to use. The down side to that is that the corn syrup syrup drowns out some of the flavors. Many microbrews are using cane sugar again, although it costs more, to get a better taste. Vernor's is still aged in oak barrels for 3 years, no doubt accounting for the smoothness. All in all a great soda for anytime. The soda is also known, like other ginger drinks, for its use as a home remedy for an upset stomach.<br />Vernor's is a regional soda, and there are many areas of the country you can't find it in. That is why it sells here. They may be selling it in glass bottles again soon, at least there is a page that says so the day I am writing this comment. Search at Amazon for ASIN: B001JK2SEG to see what I mean. Vernors has quite a history, and there are two books at Amazon about the soda. The first is Vernor's Ginger Ale (Images of America: Michigan) ISBN-10: 0738551856. The second book is ""The Vernor's Story: From Gnomes to Now"" ISBN-10: 0472066978 a book about the company's marketing green and gold packaging with the famous gnome, and Vernor's fans.",made michigan since 1866,like vernor s drink time old fashioned drink michigan since 1866 labeling known lovely green gold colors gnome character look actually called ginger soda instead ale different typical ginger ale taste vernors strong vanilla presence smoother moist sweeter ginger ale closer cream soda ginger ale good ginger ale dry higher carbonation spicier bite vernors 39 grams sugar per versus 33 grams per schweppes ginger ale neither caffeinethe recipe changed bit years mostly choice sweeteners use high fructose corn syrup costcutting mega soda companies use rather cane sugar used use side corn syrup syrup drowns flavors many microbrews using cane sugar although costs get better taste vernor s still aged oak barrels 3 years doubt accounting smoothness great soda anytime soda also known like ginger drinks use home remedy upset stomachvernor s regional soda many areas country ca nt find sells may selling glass bottles soon least page says day writing comment search amazon asin b001jk2seg see mean vernors quite history two books amazon soda first vernor s ginger ale images america michigan isbn10 0738551856 second book vernor s story gnomes isbn10 0472066978 book company s marketing green gold packaging famous gnome vernor s fans,0.015228426395939087,0.75,0.029850746268656712,0.01020408163265306,0.6666666666666666,0.02010050251256281,0.015228426395939087,0.75,0.029850746268656712
947,B000ER6YO0,A16XMNOX8N0DOQ,Momjules,1,3,4,1319760000,My baby liked it,I didn't eat any but my baby liked it. She said it was savory but sweet and it reminded her of fine dining in Tuscany. Also I like that with the jarred foods is you know when you recycle it will never become waste. I just learned this and am telling everyone - only glass recycles forever. And if you don't recycle then you and I have nothing in common and you should stop reading here. It's not even a hard thing to do anymore. Nobody else in my building recycles and it drives me crazy. You just rinse it and put it in a different bin and still put it out on trash day. Stop being lazy.,baby liked,nt eat baby liked said savory sweet reminded fine dining tuscany also like jarred foods know recycle never become waste learned telling everyone glass recycles forever nt recycle nothing common stop reading s even hard thing anymore nobody else building recycles drives crazy rinse put different bin still put trash day stop lazy,0.03125,1.0,0.06060606060606061,0.015873015873015872,1.0,0.03125,0.03125,1.0,0.06060606060606061
290,B001UJEN6C,AIW47KAXVTR0X,"C. Williams ""will5927""",7,8,5,1268092800,Great Energy,I bought these for my husband and he said they are the best energy shots out there. He takes one in the mornings and works hard all day. Good stuff!,great energy,bought husband said best energy shots takes one mornings works hard day good stuff,0.043478260869565216,0.5,0.08,0.0,0.0,0.0,0.043478260869565216,0.5,0.08
166,B003TQQKFQ,A2TUJ3MOKXZVYK,Amy,1,1,5,1338508800,This stuff is sooooo good!,"I read about pomegranate molasses so I had to try it! I haven't made anything with it yet, just eaten a little bit at a time but WOW is it decadent! It's dark, syrupy, sour, and a little sweet. A dab of this and I forget about dessert. It's just a really unique flavor with a pleasing metallic undertone. Yum!! I'm going to try making fesenjan next :-)",stuff sooooo good,read pomegranate molasses try nt made anything yet eaten little bit time wow decadent s dark syrupy sour little sweet dab forget dessert s really unique flavor pleasing metallic undertone yum m going try making fesenjan next,0.0,0.0,0.0,0.0,0.0,0.0,0.0,0.0,0.0
762,B006JWQFC0,A1WWAQFIYLCL0Y,"Richard L. Costello ""rbjrev""",0,0,1,1350259200,IT'S A LAXATIVE,"This item, WERTHER'S SUGAR FREE HARD CANDY, if consumed, will give you - or your friends, loose bowels. I purchased 12 bags and discovered more than a bowel problem: You can't return them. Need a laxative? I have ten unopened bags you can have - for free.",s laxative,item werther s sugar free hard candy consumed give friends loose bowels purchased 12 bags discovered bowel problem ca nt return need laxative ten unopened bags free,0.06896551724137931,1.0,0.12903225806451613,0.0,0.0,0.0,0.06896551724137931,1.0,0.12903225806451613
498,B000G6RYNE,AJQD2WWJYOYFQ,bubbles,0,0,4,1186617600,"Tangy, spicy, and sweet- oh my!","Kettle Chips Spicy Thai potato chips have the perfect amount of sweet, savory and spicy-- everything you'd want in a good meal or better yet...a potato chip.  Since these are kettle-cooked, the chips are uniquely shaped and are sometimes a bit over-browned.  They are, however, sliced just perfectly, not too thick, not too thin, so you can actually get a great crunch with each bite without breaking a tooth off.  The flavor is tremendous, although I wouldn't describe it as Thai.  It's more of a vague, sweet and tangy flavor with a kick, and every now and then you get a great big hit of ginger.  If you like any spice at all, these really are not overly spicy, so most people can handle them.  The fact that these chips have absolutely no artificial ingredients or trans fat makes them a fabulous addition to any muncher's snack cupboard.",tangy spicy sweet oh,kettle chips spicy thai potato chips perfect amount sweet savory spicy everything d want good meal better yet potato chip since kettlecooked chips uniquely shaped sometimes bit overbrowned however sliced perfectly thick thin actually get great crunch bite without breaking tooth flavor tremendous although would nt describe thai s vague sweet tangy flavor kick every get great big hit ginger like spice really overly spicy people handle fact chips absolutely artificial ingredients trans fat makes fabulous addition muncher s snack cupboard,0.03409090909090909,0.75,0.06521739130434782,0.0,0.0,0.0,0.022727272727272728,0.5,0.04347826086956522
