Id,ProductId,UserId,ProfileName,HelpfulnessNumerator,HelpfulnessDenominator,Score,Time,Summary,Text,Processed_Summary,Processed_Text,ROUGE-1 Precision,ROUGE-1 Recall,ROUGE-1 F1,ROUGE-2 Precision,ROUGE-2 Recall,ROUGE-2 F1,ROUGE-L Precision,ROUGE-L Recall,ROUGE-L F1
817,B004ET7MG8,A3THFR9NVPSUIP,D. S. MD,2,4,5,1293926400,Delicious IMO and.... helps weight loss,"If some other yahoo deems it ok to give give a suck review to this stuff because he doesn't like the taste, I feel I must assert that in this -as in all matters of taste- ""De Gustibus Non Disputandem Est"".<br /><br />I really love this gum. OK it doesn't really taste like strawberry, but it's still delicious. It has a wonderfully smooth consistency about halfway through, but then it gets tired, stuff, and squeaky.<br /><br />You'll forgive the squeaks perhaps when you find, as I did, that this stuff is a wonderful dietetic aid. By obsessively chewing this product I filled my gut with odorless room air and so helped me lose 25# in 3 months.<br /><br />Also, it doesn't lose its flavor on the bedpost overnight.",delicious imo helps weight loss,yahoo deems ok give give suck review stuff nt like taste feel must assert as matters taste de gustibus non disputandem est i really love gum ok nt really taste like strawberry s still delicious wonderfully smooth consistency halfway gets tired stuff squeakyyou ll forgive squeaks perhaps find stuff wonderful dietetic aid obsessively chewing product filled gut odorless room air helped lose 25 3 monthsalso nt lose flavor bedpost overnight,0.021505376344086023,0.4,0.040816326530612256,0.0,0.0,0.0,0.021505376344086023,0.4,0.040816326530612256
810,B0030C9A60,A22SF4XQI6LLUS,"Michael Mcadams ""Scout collector""",0,0,5,1326758400,Chocolate - How can you go wrong?,Great for serving Chocolate liquor. Adds a touch of class to your event and elevates you to host supreme. Being able to eat the cup afterwards is just icing on the cake.,chocolate go wrong,great serving chocolate liquor adds touch class event elevates host supreme able eat cup afterwards icing cake,0.05263157894736842,0.3333333333333333,0.09090909090909091,0.0,0.0,0.0,0.05263157894736842,0.3333333333333333,0.09090909090909091
483,B000G6RYNE,A26ONAQEIUEMV4,"Dolores Swan ""Swannie""",0,0,5,1215129600,Very good chips at a great price.,"These chips are quite tasty and the price is right.  Packaged very well, would buy again.",good chips great price,chips quite tasty price right packaged well would buy,0.1111111111111111,0.5,0.1818181818181818,0.0,0.0,0.0,0.1111111111111111,0.5,0.1818181818181818
446,B000G6RYNE,A19G8B2QYETD7W,NyahNyah,0,0,3,1297555200,Heavy on the Vinegar,"I usually love Kettle Chips, and love salt & vinegar, but these chips were way too vinegary for me! They do have the typical kettle chip crunch, but are too aggressively flavored for my taste.",heavy vinegar,usually love kettle chips love salt vinegar chips way vinegary typical kettle chip crunch aggressively flavored taste,0.03333333333333333,0.5,0.0625,0.0,0.0,0.0,0.03333333333333333,0.5,0.0625
200,B0028C44Z0,A1WTXY4MW3YDF2,Gordon,0,0,5,1344729600,These mints are awesome!,This is a huge supply of them. I'm still working on these and have plenty to spare. Much more effective than buying one from the grocery store or 7-11 every time you want a mint.,mints awesome,huge supply m still working plenty spare much effective buying one grocery store 711 every time want mint,0.0,0.0,0.0,0.0,0.0,0.0,0.0,0.0,0.0
501,B000G6RYNE,A2LGWBIT9WCTVA,D. Gesswein,0,0,5,1173312000,Excellent chip!,"I bought these for the office and no one can put them down. I'm ordering more today and it has only been 2 weeks. Didn't have to shop for them either, Amazon brought it to my door!",excellent chip,bought office one put m ordering today 2 weeks nt shop either amazon brought door,0.0,0.0,0.0,0.0,0.0,0.0,0.0,0.0,0.0
774,B005YNDIAW,AGE88BOVVQ22J,MJ,0,0,5,1340582400,Yummy!,"I eat mustard with everything, this is hands down THE BESt mustard I have ever tried, in fact everyone I tell to try some, falls in love with it as well. Spicy, tasty, real quality.<br />If you like spicy mustard, you will love this.",yummy,eat mustard everything hands best mustard ever tried fact everyone tell try falls love well spicy tasty real qualityif like spicy mustard love,0.0,0.0,0.0,0.0,0.0,0.0,0.0,0.0,0.0
108,B001REEG6C,A30835UIR6F8KB,Adam E. Smith,2,2,5,1295308800,Wasting Vinegar on a Cucumber is a Shame!,"I first bought pickled asparagus at an Amish market and it was love at first bite. Hence, when I saw these on the discount rack at the local Safeway I cleaned it out.  These are even better than the ones from the Amish market. They are fantastic, and some of the jars have a bonus clove of garlic at the bottom. I'm going to order the six pack and I'm a household of one. They wont go to waste!",wasting vinegar cucumber shame,first bought pickled asparagus amish market love first bite hence saw discount rack local safeway cleaned even better ones amish market fantastic jars bonus clove garlic bottom m going order six pack m household one wont go waste,0.025,0.25,0.045454545454545456,0.0,0.0,0.0,0.025,0.25,0.045454545454545456
219,B001EO5ZMO,AW497M5SEXAPQ,Neal Pollack,5,5,5,1266105600,Ahmad Loose Imperial Blend Tea is great for the price,"A friend who'd been drinking tea for 80 of his 84 years introduced me to this tea a few months ago. Even took me over to the store and bought me a pound. At $7/lb. in a retail store or a little over $9 with shipping from an online merchant, I think it's great. I've been drinking Earl Grey, English Breakfast, Irish Breakfast, Lapsang Souchong, Assam, etc. Most of them were over $30/lb. with shipping. Aside from the Lapsang Souchong, I think this is a great replacement for all the rest. Has everything I'm looking for in a strong, full-bodied black tea with enough character to keep it from becoming boring. My current favorite afternoon tea. Unless you're extremely jaded or a tea snob, you'll love it.",ahmad loose imperial blend tea great price,friend d drinking tea 80 84 years introduced tea months ago even took store bought pound 7lb retail store little 9 shipping online merchant think s great ve drinking earl grey english breakfast irish breakfast lapsang souchong assam etc 30lb shipping aside lapsang souchong think great replacement rest everything m looking strong fullbodied black tea enough character keep becoming boring current favorite afternoon tea unless re extremely jaded tea snob ll love,0.02631578947368421,0.2857142857142857,0.04819277108433735,0.0,0.0,0.0,0.02631578947368421,0.2857142857142857,0.04819277108433735
421,B004X8TK8I,AMRMK86X3PKXD,R. Thomasson,0,0,5,1337644800,Wow,"I was not expecting to like these cookies as much as I do. I like chocolate chip cookies well enough, but I really prefer a soft cookie to crisp ones. I have to say these Famous Amos cookies have pertty much turned me around. The cookies are rich and have that depth of flavor that comes from quality ingredients. The chips are real chocolate and melt redilly in your mouth creating a moist experience while chewing. These are truly great cookies.",wow,expecting like cookies much like chocolate chip cookies well enough really prefer soft cookie crisp ones say famous amos cookies pertty much turned around cookies rich depth flavor comes quality ingredients chips real chocolate melt redilly mouth creating moist experience chewing truly great cookies,0.0,0.0,0.0,0.0,0.0,0.0,0.0,0.0,0.0
175,B0025VRCJY,A3PPOTV6659ATF,Jerald,5,6,4,1280793600,Great but not as good as it was back in the day as a teen,I used to love these growing up and stopped drinking water and lemon juice from this brand about 5-6 years ago. This stuff used to be so strong i used to just pour some in my mouth and get that alive feeling going. It feels like the product went through changes which added more water or something to make it not so strong. The stronger it is the less you use as well. The product is still really good but the taste is the same quality as the cheaper brand names almost. I thought  these would go fast but hey all lemon stuff i love unless it goes bad. This is a good product just wish it still had that hit me in the mouth chug sensation it used to be like.,great good back day teen,used love growing stopped drinking water lemon juice brand 56 years ago stuff used strong used pour mouth get alive feeling going feels like product went changes added water something make strong stronger less use well product still really good taste quality cheaper brand names almost thought would go fast hey lemon stuff love unless goes bad good product wish still hit mouth chug sensation used like,0.014084507042253521,0.2,0.02631578947368421,0.0,0.0,0.0,0.014084507042253521,0.2,0.02631578947368421
721,B000G6MBX2,A1D0P49A1MQO1O,"JSY9951 ""JSY9951""",0,1,5,1209340800,The best chips ever!!!,"I received this chips in a gift basket and absolutely loved them. I searched high and low, but was unable to find them until I saw them here. I immediately ordered a case. These chips are light, crispy, flavorful, and good for you. I love them with dip, in chili, or just plain. Once you try them, you'll be hooked!",best chips ever,received chips gift basket absolutely loved searched high low unable find saw immediately ordered case chips light crispy flavorful good love dip chili plain try ll hooked,0.03333333333333333,0.3333333333333333,0.0606060606060606,0.0,0.0,0.0,0.03333333333333333,0.3333333333333333,0.0606060606060606
520,B000G6RYNE,A4NDPXCYKRCY2,Janet R. Miles,0,1,2,1258588800,POTATO CHIPS,"Being a salt-free product is why I purchased this, but the chips are quite greasy.",potato chips,saltfree product purchased chips quite greasy,0.08333333333333333,0.5,0.14285714285714285,0.0,0.0,0.0,0.08333333333333333,0.5,0.14285714285714285
454,B000G6RYNE,A1L17QW3R7A519,The Boom,0,0,5,1281571200,Yum!,My husband and I LOVE these chips! Personally I think the flavor is perfect. Try them for yourself!,yum,husband love chips personally think flavor perfect try,0.0,0.0,0.0,0.0,0.0,0.0,0.0,0.0,0.0
930,B000ER6YO0,A11LJJL1SOH6W0,"Sarah Ross ""Mamasaurus Rex""",0,0,4,1296259200,My daughter's favorite jarred food,"My 7-1/2 month old absolutely loves this one...by far, it is her favorite jarred baby food. I like it because the lentils add a bit more protein than your average baby food, and I'm not ready to introduce her to meats yet.<br /><br />I do subscribe & save, which brings the price down to $0.80/jar. That's a fair price - not an amazing deal, but roughly equivalent to sale prices at the grocery store.  The bigger issue is that this particular blend is hard to find - I have to go to Whole Foods. My regular grocery store and Target carry Earth's Best, but not this blend. My daughter likes it so much, though, that I would still buy even if the price were a bit higher than store prices. It's a good one!",daughter s favorite jarred food,712 month old absolutely loves one far favorite jarred baby food like lentils add bit protein average baby food m ready introduce meats yeti subscribe save brings price 080jar s fair price amazing deal roughly equivalent sale prices grocery store bigger issue particular blend hard find go whole foods regular grocery store target carry earth s best blend daughter likes much though would still buy even price bit higher store prices s good one,0.06666666666666667,1.0,0.125,0.013513513513513514,0.25,0.025641025641025644,0.04,0.6,0.075
40,B001EO5QW8,AO80AC8313NIZ,kYpondman,0,0,5,1317168000,Wife's favorite Breakfast,"I ordered this for my wife as it was reccomended by our daughter.  She has this almost every morning and likes all flavors.  She's happy, I'm happy!!!<br /><a href=""http://www.amazon.com/gp/product/B001EO5QW8"">McCANN'S Instant Irish Oatmeal, Variety Pack of Regular, Apples & Cinnamon, and Maple & Brown Sugar, 10-Count Boxes (Pack of 6)</a>",wife s favorite breakfast,ordered wife reccomended daughter almost every morning likes flavors s happy m happy mccann s instant irish oatmeal variety pack regular apples cinnamon maple brown sugar 10count boxes pack 6,0.05,0.5,0.09090909090909091,0.0,0.0,0.0,0.05,0.5,0.09090909090909091
552,B000G6RYNE,A2B5OI74EHGVH1,"Jane ""jdeaton2""",3,8,1,1273017600,dripping in oil,"I purchased these because of the low salt, and they were indeed low in salt. However, many, many of the chips in the bag were literally dripping in oil. I have never encountered this problem with other potato chip brands. It was very unappetizing, and who wants all that oil? I will never buy these again, and I would not recommend them to others.",dripping oil,purchased low salt indeed low salt however many many chips bag literally dripping oil never encountered problem potato chip brands unappetizing wants oil never buy would recommend others,0.0625,1.0,0.11764705882352941,0.03225806451612903,1.0,0.0625,0.0625,1.0,0.11764705882352941
820,B003AO5DLO,A228Q0U7S4D88X,Harley Quinn,2,2,5,1314144000,My dog loves this food!,"Our Spaniel has tried several foods in her 6 years, and this is the only one she will eat by itself without any ""people food"" being added (of course, we still treat her occasionally).  When we went in for our 12 month tooth-cleaning appointment, the vet told us to take her home as her teeth didn't need any cleaning for another 6 months, at least.  It is specially designed for their teeth and health needs, and she loves it.  And it is actually cheaper here than at the fancy pet store!  What more could you ask?",dog loves food,spaniel tried several foods 6 years one eat without people food added course still treat occasionally went 12 month toothcleaning appointment vet told us take home teeth nt need cleaning another 6 months least specially designed teeth health needs loves actually cheaper fancy pet store could ask,0.03636363636363636,0.6666666666666666,0.06896551724137931,0.0,0.0,0.0,0.01818181818181818,0.3333333333333333,0.034482758620689655
352,B0029OWDAU,A1DTDSL1J6C05F,"Heartsinohio ""Heartsinohio""",0,0,5,1347667200,Love Love Love,"Popchips are so good.  I have been following Weight Watchers and lost 50 pounds and am at my goal.  These Popchips are my salty crunchy indulgence.  They taste so  good,",love love love,popchips good following weight watchers lost 50 pounds goal popchips salty crunchy indulgence taste good,0.0,0.0,0.0,0.0,0.0,0.0,0.0,0.0,0.0
67,B005DUM9UQ,AEFIZIJ1FK1BK,Doug,0,0,5,1345161600,Low Carb Alternative to Gatorade,"For those of us on a low carb diet these little tablets are just the thing.<br /><br />Two years ago I started cycling again after many years but was having heart arrhythmia after longer rides in high heat.  I was drinking plain water but did a little research and thought electrolytes might be the issue.  Gatorade wasn't an option because it is so loaded with carbohydrates so I looked around for a low-carb alternative.  The ""zero carb"" sports drinks didn't help so what to do?  One day I ran across these at my bike shop so tried a tube of them.....voila!...problem solved!!<br /><br />I've shared them with two friends in particular whose problems with leg cramps were resolved while using these.<br /><br />These guys got it right -- they are superbly formulated and simply work.....",low carb alternative gatorade,us low carb diet little tablets thingtwo years ago started cycling many years heart arrhythmia longer rides high heat drinking plain water little research thought electrolytes might issue gatorade nt option loaded carbohydrates looked around lowcarb alternative zero carb sports drinks nt help one day ran across bike shop tried tube voila problem solved ve shared two friends particular whose problems leg cramps resolved using thesethese guys got right superbly formulated simply work,0.05194805194805195,1.0,0.09876543209876544,0.013157894736842105,0.3333333333333333,0.02531645569620253,0.03896103896103896,0.75,0.07407407407407407
278,B001D07IPG,A3QN14A5DGUA0U,J. Kraayenbrink,0,0,5,1343692800,Excellent for G/F,"Please ignore the one-star comments, if you check the bag the main ingredient IS in fact whole grain brown rice and the second is rice flower. With anything that is gluten free you have to add another ""binder"" which is where the corn flour comes in. For someone who has celiac disease and cannot have Sunchips, because they contain wheat (a key binder to any chip, cookie or cereal) this is an excellent product. My spouse and I buy these a lot because they are gluten free and absolutely delicious!",excellent gf,please ignore onestar comments check bag main ingredient fact whole grain brown rice second rice flower anything gluten free add another binder corn flour comes someone celiac disease sunchips contain wheat key binder chip cookie cereal excellent product spouse buy lot gluten free absolutely delicious,0.021739130434782608,0.5,0.041666666666666664,0.0,0.0,0.0,0.021739130434782608,0.5,0.041666666666666664
68,B005DUM9UQ,A8OFFIAL6XTOH,Bill Shirer,0,1,2,1338422400,Taste is not so good.,"I purchased the Mango flavor, and to me it doesn't take like Mango at all.  There is no hint of sweetness, and unfortunately there is a hint or aftertaste almost like licorice.  I've been consuming various sports nutrition products for decades, so I'm familiar and have come to like the taste of the most of the products I've tried.  The mango flavor is one of the least appealing I've tasted.  It's not terrible, but it's bad enough that I notice the bad taste every sip I take.",taste good,purchased mango flavor nt take like mango hint sweetness unfortunately hint aftertaste almost like licorice ve consuming various sports nutrition products decades m familiar come like taste products ve tried mango flavor one least appealing ve tasted s terrible s bad enough notice bad taste every sip take,0.015625,0.5,0.030303030303030304,0.0,0.0,0.0,0.015625,0.5,0.030303030303030304
907,B000ER6YO0,A1UTKYFGM2ITLU,B. Citron,1,1,1,1321142400,Plastic in the food!,"Wow, i am shocked to find clear plastic pieces in the jars. The other posters say they notified Earth's Best about this in August and they are still selling it without checking or recalling!! No more earth's best for my little guy. I am taking my business elsewhere and I am very sad that organic company is selling baby food with plastic and bpa in their jars. They gotta do better than this to get my business.",plastic food,wow shocked find clear plastic pieces jars posters say notified earth s best august still selling without checking recalling earth s best little guy taking business elsewhere sad organic company selling baby food plastic bpa jars got ta better get business,0.043478260869565216,1.0,0.08333333333333333,0.0,0.0,0.0,0.043478260869565216,1.0,0.08333333333333333
915,B000ER6YO0,AB0BXP1IKDBIA,TreGemellini,1,1,1,1278892800,Runny and odd-tasting,"My triplets will not eat this, eventhe one who will eat ANYTHING. The consistency is way too runny as well and does not stay on the spoon.",runny oddtasting,triplets eat eventhe one eat anything consistency way runny well stay spoon,0.058823529411764705,0.5,0.10526315789473684,0.0,0.0,0.0,0.058823529411764705,0.5,0.10526315789473684
945,B000ER6YO0,A6LAMY7Z10BBJ,Amazon Shopper,0,1,5,1286928000,Baby likes this one,"The earths best he eats the most, this one is a little thicker than his original chicken/sweet potato favorite which is very runny.",baby likes one,earths best eats one little thicker original chickensweet potato favorite runny,0.07142857142857142,0.3333333333333333,0.11764705882352941,0.0,0.0,0.0,0.07142857142857142,0.3333333333333333,0.11764705882352941
297,B001UJEN6C,A3UD9G34YLWVXE,Thezwomann,2,2,4,1322265600,This stuff works!!!,"The energy shot truly does work! It had a terrible after-taste at first, but now that I know what to expect, I am getting used to it. I always have some water handy as a chaser...which helps! I am so glad to have found something that gives me the energy I need without all the chemicals found in other beverages. It's helped me kick my addiction to Diet Coke and other aspartame-laced caffeinated beverages. Yay!!!",stuff works,energy shot truly work terrible aftertaste first know expect getting used always water handy chaser helps glad found something gives energy need without chemicals found beverages s helped kick addiction diet coke aspartamelaced caffeinated beverages yay,0.02631578947368421,0.5,0.05,0.0,0.0,0.0,0.02631578947368421,0.5,0.05
619,B000G6RYNE,A3MTY0ZE9WYJHL,"Earl M. Rce ""ezdouble07""",3,4,3,1191110400,I dont know if...,I dont know if they were fresh or if they were supposed to taste like they did. I checked the expiration date it was current but still tasted kind of stale to me !!!,dont know,dont know fresh supposed taste like checked expiration date current still tasted kind stale,0.09090909090909091,1.0,0.16666666666666669,0.047619047619047616,1.0,0.0909090909090909,0.09090909090909091,1.0,0.16666666666666669
599,B000G6RYNE,A2N10M1J3KJZK4,MT_Soul,1,1,5,1249084800,These chips will make you fat,But you will enjoy ever step. I gained 5 lbs within a month of buying this 12 pack of full sized bags. Damn it! They should warn you about this! Tastes awesome though. When I finish my crash diet I will order another box (case?). :-),chips make fat,enjoy ever step gained 5 lbs within month buying 12 pack full sized bags damn warn tastes awesome though finish crash diet order another box case,0.0,0.0,0.0,0.0,0.0,0.0,0.0,0.0,0.0
905,B000ER6YO0,A1K4TZD6TPLKOC,Lisa Schaal Robinson,1,1,5,1337731200,Baby Lilly says 2 thumbs up!,"My little girl can't get enough of this! I like that it is organic and contains fruit, veggies, protein and grains in one tasty meal. I wish it came in larger portions since my 10 month old always wants 2 jars.",baby lilly says 2 thumbs,little girl ca nt get enough like organic contains fruit veggies protein grains one tasty meal wish came larger portions since 10 month old always wants 2 jars,0.02857142857142857,0.2,0.049999999999999996,0.0,0.0,0.0,0.02857142857142857,0.2,0.049999999999999996
849,B0041CKRJC,A2EIIDTYMJAEXV,"Tattletails ""Bonny""",1,1,5,1346198400,Aluminum Free!,"This baking soda works great for cooking or for health reasons.  I take it for acid indigestion and heart burn.  Just a 1 tsp in a half glass of water and it's gone.  I use it to make my body more alkaline, so it's great for changing your pH level in your body!",aluminum free,baking soda works great cooking health reasons take acid indigestion heart burn 1 tsp half glass water s gone use make body alkaline s great changing ph level body,0.0,0.0,0.0,0.0,0.0,0.0,0.0,0.0,0.0
424,B000G6RYNE,A1IRN1M05TPOVT,"Sharon M. Helfand ""Scrapper""",0,0,5,1334620800,Kettle potato chips:  Fully loaded baked potato,"I have never met a Kettle brand chip I did not like. These chips have a great loaded potato flavor, which are flavorful. I like the sweet onion chips better, but these are also at the top of the list for great-tasting potato chips. Kettle chips are great chips f/the money!",kettle potato chips fully loaded baked potato,never met kettle brand chip like chips great loaded potato flavor flavorful like sweet onion chips better also top list greattasting potato chips kettle chips great chips fthe money,0.16129032258064516,0.7142857142857143,0.2631578947368421,0.03333333333333333,0.16666666666666666,0.05555555555555555,0.12903225806451613,0.5714285714285714,0.2105263157894737
758,B0035YE9CS,A2ZVXWYWGSEIVF,"Teresa C. Holder ""Cook book Gatherer""",0,0,5,1305072000,Great sauce!,This is the most delicious soy sauce I have ever tasted.  I will surely order it again.  Such deep flavor.,great sauce,delicious soy sauce ever tasted surely order deep flavor,0.14285714285714285,1.0,0.25,0.0,0.0,0.0,0.14285714285714285,1.0,0.25
313,B002X9JNYU,AVPSSODZIDABZ,HELfromBL,1,3,1,1323388800,what quantity is it!,I wouldn't even think of buying this product unless I know the price per unit. How can I compare other items online or in a store?,quantity,would nt even think buying product unless know price per unit compare items online store,0.0,0.0,0.0,0.0,0.0,0.0,0.0,0.0,0.0
185,B001KUUNP6,A317BY3IPZ83MJ,"James G. Colet ""psychocarp""",3,3,5,1235520000,Garbonzo  Bean Flour,This  is great stuff.  Made some really tasty banana bread.  Good quality and lowest price in town.,garbonzo bean flour,great stuff made really tasty banana bread good quality lowest price town,0.0,0.0,0.0,0.0,0.0,0.0,0.0,0.0,0.0
333,B007DJ0O9I,A328TUPI6HYZSF,Maplerise Mom,0,1,5,1336521600,Pop-Tarts Work of Art,"I found these new spring Pop-Tarts and bought them on a whim.  My kids and I were amazed and delighted at the fun, colorful, amazingly detailed artwork on these Pop-Tarts.  Fantastic for after school snacks, lunch boxes, and school treats. Tie with a ribbon for a bright ""thinking of you this spring"" gift.  The only challenge is finding more in stores.  Way to go Kellogg's - fantastic product!",poptarts work art,found new spring poptarts bought whim kids amazed delighted fun colorful amazingly detailed artwork poptarts fantastic school snacks lunch boxes school treats tie ribbon bright thinking spring gift challenge finding stores way go kellogg s fantastic product,0.02631578947368421,0.3333333333333333,0.048780487804878044,0.0,0.0,0.0,0.02631578947368421,0.3333333333333333,0.048780487804878044
